{
  "hiddenId": "WSCH-0001",
  "collection": "vanilla",
  "publicId": 1,
  "title": "Farmyard",
  "wordGroups": ["farm-animals", "farm-places"],
  "words": [
    { "display": "Pig-pen", "start": { "row": 0, "col": 0 }, "direction": "E", "length": 6 },
    { "display": "Cat", "start": { "row": 1, "col": 0 }, "direction": "S", "length": 3 },
    { "display": "Cow", "start": { "row": 1, "col": 0 }, "direction": "E", "length": 3 },
    { "display": "Hen", "start": { "row": 1, "col": 5 }, "direction": "S", "length": 3 },
    { "display": "Ewe", "start": { "row": 2, "col": 5 }, "direction": "W", "length": 3 },
    { "display": "Dog", "start": { "row": 5, "col": 0 }, "direction": "E", "length": 3 },
    { "display": "God", "start": { "row": 4, "col": 0 }, "direction": "E", "length": 3 }
  ],
  "grid": [
    "PIGPEN",
    "COWIAH",
    "APIEWE",
    "TIAPIN",
    "GODIAD",
    "DOGAPI"
  ]
}
